{
  "version": "kar-1-research-1",
  "status": "SATISFIED",
  "evidenceIds": [
    "sha256-11d7370d503b329efad8633f8f4e04e30fdd173814af379a3752aab615e0a0ca",
    "sha256-a1f5e158d8aa2575a255cc30893715875dc676804f31e4ed02bfad1d4fb14e5b"
  ],
  "choices": [
    {
      "evidenceId": "sha256-11d7370d503b329efad8633f8f4e04e30fdd173814af379a3752aab615e0a0ca",
      "frontiers": [
        "F_S"
      ]
    },
    {
      "evidenceId": "sha256-a1f5e158d8aa2575a255cc30893715875dc676804f31e4ed02bfad1d4fb14e5b",
      "frontiers": [
        "F_O"
      ]
    }
  ],
  "frontiers": {
    "F_S": [
      "sha256-11d7370d503b329efad8633f8f4e04e30fdd173814af379a3752aab615e0a0ca"
    ],
    "F_O": [
      "sha256-a1f5e158d8aa2575a255cc30893715875dc676804f31e4ed02bfad1d4fb14e5b"
    ],
    "F_Q": [],
    "F_T": [],
    "F_A": []
  },
  "witnesses": [
    {
      "evidenceId": "sha256-a1f5e158d8aa2575a255cc30893715875dc676804f31e4ed02bfad1d4fb14e5b",
      "frontier": "F_O",
      "anchorId": "sha256-ca9862ca023562276ebeeaf7b94f0c57215b461943ad3ed5e068943b417e17f8",
      "path": [
        {
          "node": "sha256-ca9862ca023562276ebeeaf7b94f0c57215b461943ad3ed5e068943b417e17f8"
        },
        {
          "relation": "sha256-f39e7c33acd288ce3d24d1eb7c47311d1c738795aeb99c5745af560d6c3d8bf7",
          "node": "sha256-ba7983a7af814d40e1336459b62d60150375b4dbcf0ddacd1ae1531a87ca1555"
        }
      ]
    },
    {
      "evidenceId": "sha256-11d7370d503b329efad8633f8f4e04e30fdd173814af379a3752aab615e0a0ca",
      "frontier": "F_S",
      "anchorId": "sha256-ca9862ca023562276ebeeaf7b94f0c57215b461943ad3ed5e068943b417e17f8",
      "path": [
        {
          "node": "sha256-ca9862ca023562276ebeeaf7b94f0c57215b461943ad3ed5e068943b417e17f8"
        },
        {
          "relation": "sha256-5e1357a0ca9112351b9be42a0202739eb88031a59731ef4e63b8dab366e77f78",
          "node": "sha256-ae3d664a4f51ee3303d6714344f93b201c120c31d0c4ac543ada6339c62b1369"
        }
      ]
    }
  ],
  "decision": {
    "status": "SATISFIED",
    "profile": "minimum-cover",
    "cardinality": 2,
    "coverage": {
      "F_S": {
        "covered": 1,
        "required": 1
      },
      "F_O": {
        "covered": 1,
        "required": 1
      },
      "F_Q": {
        "covered": 0,
        "required": 0
      },
      "F_T": {
        "covered": 0,
        "required": 0
      },
      "F_A": {
        "covered": 0,
        "required": 0
      }
    }
  },
  "roots": {
    "knowledgeRoot": "sha256-35e5cd0b1e08472b38bafffd79b7dfd00db508cc129eb426cd6ba932a9a99a27",
    "semanticRoot": "sha256-6e14e7639cff187a58b137e3507f65534edf728d0cf133e26e94f472eb322628",
    "queryRoot": "sha256-a8eddf704181902e85e93c8dbb4fdeb9516f74b2bebd3b07268e1a9598de3656",
    "planRoot": "sha256-f9237b4e352511a4f22ef3510ac9edbe5e55338f91ab852aa604637d72977948",
    "anchorRoot": "sha256-723750047782c15aaa9b18a6fb63abc9e5959cd254a57f2154d42959f1c59dca",
    "frontierRoot": "sha256-0b844baffce47029d4e51edfe9e9a8d055c11fa84e66ea02ec0b8ae806968ac5",
    "frontierWitnessRoot": "sha256-f3de760a736c18494824fda97401ea8db562d8dca89d523b3ada2dbb50e1f90f",
    "evidenceSetRoot": "sha256-04fc5ec321b96eb00e8c281542582b4d22c892197c6a17abb10616351cd8c150",
    "decisionRoot": "sha256-ba643ef0dcb933a375cfd8f7bc3bb47ddad181564c32ed1918cffe0224a14550",
    "karRoot": "sha256-73735c412c2b86f8b026a6e0c9408af7afcbfdf035defb8919fa7a285dcf1985"
  }
}
